{
  "protocolVersion": 1,
  "type": "game.action",
  "commandId": "00000000-0000-4000-8000-000000000011",
  "matchId": "00000000-0000-4000-8000-000000000002",
  "handId": "00000000-0000-4000-8000-000000000003",
  "turnId": "00000000-0000-4000-8000-000000000004",
  "expectedVersion": "43",
  "payload": { "kind": "FOLD" }
}
